Item No# ,Purchase Order date ,Item ,Quantity ,NT Unit price ,Unit price (Vat incl) ,Service Provider ,Amount ,Purchase Order Number ,Method of Procurement 
1. ,20/03/2020 ,Supply and delivery of sanitizers and gloves ,"1400 litres 
1 box of gloves ",Price not determined during this procurement as the RT contracts were not yet finalised by National Treasury ,R138.78 ,Masana Hygiene Services ,"R196,129.48 ",SCM/PO 230/2019/20 ,Quotations were sourced from 5 service providers on Central Supplier Database (CSD). Only 3 responded as the RT contract (National Treasury Transversal Contract) communication from NT was not issued. Lowest bidder was appointed. 
2. ,07/04/2020 ,Supply and delivery of Surgical Masks ,10000 surgical masks ,R26.65 ,R23.50 ,Hithina (Pty) Ltd ,"R235,000.00 ",SCM/PO 002/2020/21 ,Quotations were sourced from the RT Contract list provided by National Treasury. No responses were received. The bid was re-advertised to 5 additional service providers from CSD. Only 3 service providers responded. Lowest bidder was appointed. 
3. ,07/04/2020 ,Supply and delivery of Latex Gloves ,"90000 
Latex Gloves ",R4.95 ,R3.00 ,Sir ITU ,"R270,000.00 ",SCM/PO 003/2020/21 ,Quotations were sourced from the RT Contract list provided by National Treasury. No responses were received. The bid was re-advertised to 5 additional service providers from CSD. Only 3 service providers responded. Lowest bidder was appointed 
4. ,06/05/2020 ,Decontamination of Letaba and Hennops House ,3731 square metres ,"Price not determined, list of service provider was provided by NT. Quantities are as per litres on the RT contracts whereas service providers wanted to quote as per square metres ",R4.30 ,MERIDIAN Hygiene ,"R18,440.80 ",SCM/PO 018/2020/21 ,Quotation were sourced from the RT Contract list provided by National Treasury. No responses were received. The bid was re-advertised to 5 service providers from CSD. Only 3 service providers responded. Lowest bidder was appointed 
5. ,07/05/2020 ,"Temperature Scanners, infrared non contact ",4,"R2,300.00 ","R1,949.25 ",Isefields Properties ,"R7,797.00 ",SCM/PO 019/2020/21 ,Quotations were sourced from CSD list and the lowest service provider was appointed. 
6. ,14/05/2020 ,Supply and delivery of 3 layers face cloth masks ,1260 cloth masks ,R25.00 ,R25.00 ,SAI Consulting ,"R31,500.00 ",SCM/PO 021/2020/21 ,Quotation were sourced from the RT Contract list provided by National Treasury. Only 3 service providers responded. Lowest bidder was appointed. 
7. ,03/07/2020 ,Decontamination of Letaba and Hennops office space ,3484 square metres ,"Price not determined, list of service provider was provided by NT. Quantities are as per litres on the RT contracts whereas service providers wanted to quote as per square metres ","R 26,54",Biologica Pharmaceutical ,"R92,482.43 ",SCM/PO 034/2020/21 ,Quotation were sourced from the National Treasury RT list of suppliers Only 3 service providers responded. Lowest compliant bidder was appointed. 
